{
  "schema_version": 2,
  "id": "shared-request-foo",
  "title": "Request calls containing foo",
  "description": "Reports request call regions that contain the foo marker.",
  "rationale": "This example demonstrates independent predicates over a shared regex query.",
  "mode": "advisory",
  "severity": "warning",
  "execution": "file",
  "scope": {"include": ["**/*.txt"]},
  "patterns": {"request": "request\\([^\\r\\n]*\\)"},
  "diagnostics": {
    "contains-foo": {
      "kind": "violation",
      "message": "The request region contains foo.",
      "help": "Review the request marker and use the documented form."
    }
  },
  "limitations": ["This example only inspects text files and does not interpret request arguments."],
  "code": {
    "language": "wt-rule-1",
    "capabilities": ["regex.v1", "text.v1"],
    "source": "for matched in rx::find_all(file, \"request\") { if matched.text.contains(\"foo\") { emit(matched.span, \"contains-foo\"); } }"
  },
  "tests": {
    "schema_version": 2,
    "cases": [
      {
        "name": "reports-marker",
        "files": [{"path": "sample.txt", "content": "request(\"foo123\")"}],
        "expect": [{"path": "sample.txt", "code": "contains-foo", "kind": "violation"}]
      },
      {
        "name": "accepts-other-request",
        "files": [{"path": "sample.txt", "content": "request(\"bar\")"}],
        "expect": []
      }
    ]
  }
}
